{
  "schema_version": "1.3.3",
  "view_id": "orders",
  "generated_at": "2026-10-24T00:00:00+00:00",
  "sources": [
    {"source": "source", "status": "OBSERVED", "evidence_refs": ["src/Orders.tsx"]},
    {"source": "runtime", "status": "UNVERIFIED", "detail": "no runtime probe yet"},
    {"source": "contract", "status": "MISSING"}
  ],
  "pages": [
    {
      "page_id": "orders.list",
      "kind": "page",
      "route": "/orders",
      "source": {"file": "src/Orders.tsx", "line": 12},
      "archetype": "data_table",
      "confidence": 0.8,
      "capabilities": ["async_load", "collection_display"]
    }
  ],
  "capabilities": {
    "async_load": true,
    "collection_display": true,
    "user_mutation": false,
    "long_running_task": false,
    "destructive_operations": false,
    "canvas_rendering": false
  },
  "capability_evidence": [
    {
      "capability": "async_load",
      "source": {"kind": "file", "ref": "src/Orders.tsx", "locator": "useEffect"},
      "discovery": "static",
      "confidence": 0.7,
      "detail": "fetch inside useEffect"
    }
  ],
  "unverified_paths": ["runtime:/orders"]
}
